{
  "$schema": "https://json-schema.org/draft/2020-12/schema",
  "title": "Recipe Vault JSON",
  "type": "object",
  "additionalProperties": false,
  "required": [
    "schema_version",
    "title",
    "ingredients",
    "steps"
  ],
  "properties": {
    "schema_version": {
      "type": "integer",
      "const": 1
    },
    "recipe_id": {
      "type": [
        "string",
        "null"
      ],
      "description": "新規レシピはnullまたは省略。既存レシピ改良時は元のrecipe_idを維持する。"
    },
    "title": {
      "type": "string",
      "minLength": 1
    },
    "servings": {
      "type": [
        "string",
        "number"
      ]
    },
    "ingredients": {
      "type": "array",
      "minItems": 1,
      "items": {
        "type": "object",
        "additionalProperties": false,
        "required": [
          "name",
          "amount"
        ],
        "properties": {
          "name": {
            "type": "string",
            "minLength": 1
          },
          "amount": {
            "type": "string"
          }
        }
      }
    },
    "steps": {
      "type": "array",
      "minItems": 1,
      "items": {
        "type": "string",
        "minLength": 1
      }
    },
    "tags": {
      "type": "array",
      "items": {
        "type": "string"
      }
    },
    "mood_tags": {
      "type": "array",
      "items": {
        "type": "string"
      }
    },
    "cooking_time": {
      "type": [
        "string",
        "number"
      ]
    },
    "notes": {
      "type": "string"
    },
    "improvements": {
      "type": "string"
    }
  }
}
