{
  "schema_version": 1,
  "recipe_id": null,
  "title": "鶏むね肉の梅しそ焼き",
  "servings": "2人分",
  "ingredients": [
    {
      "name": "鶏むね肉",
      "amount": "1枚"
    },
    {
      "name": "梅干し",
      "amount": "2個"
    },
    {
      "name": "大葉",
      "amount": "5枚"
    }
  ],
  "steps": [
    "鶏むね肉をそぎ切りにし、軽く塩をふる。",
    "梅干しをたたき、大葉を細切りにする。",
    "フライパンで鶏肉を焼き、火が通ったら梅と大葉を加えてからめる。"
  ],
  "tags": [
    "主菜",
    "鶏肉",
    "和食"
  ],
  "mood_tags": [
    "さっぱり",
    "疲れた日向け",
    "簡単"
  ],
  "cooking_time": "20分",
  "notes": "梅干しの塩分が強い場合は塩を控える。",
  "improvements": "次回は鶏肉を薄めに切って、より短時間で火を通す。"
}
